{
  "contractVersion": "1.0.0",
  "dependsOn": [
    {
      "contractVersion": "1.0.0",
      "dependencyKind": "completion-before",
      "operationRef": "72ec9c913958934c4c10e4b2c1452676ca39f0c8ced106f328174dd0f024b699",
      "rationale": "plaster applies to the rebuilt wall surface"
    }
  ],
  "domain": {
    "contractVersion": "1.0.0",
    "extensions": [
      {
        "kind": "building-element-taxonomy",
        "ref": "aise-building-elements",
        "version": "1.0.0"
      }
    ],
    "operationVocabulary": "aise-building-operations-v1",
    "vertical": "building"
  },
  "effects": [
    {
      "affectedNodeRefs": [
        "node-wall-002"
      ],
      "contractVersion": "1.0.0",
      "effectKind": "state-transition",
      "geometryRefs": [
        {
          "kind": "polygon",
          "ref": "geo-wall-faces-002"
        }
      ],
      "resultingStateRef": "bc0031ec7a87f55bf00816c28e916b26c7b829d8cdce5a52cf62e27dd2ffe3bf"
    },
    {
      "affectedNodeRefs": [
        "node-wall-002"
      ],
      "contractVersion": "1.0.0",
      "direction": "added",
      "effectKind": "quantity-impact",
      "geometryRefs": [
        {
          "kind": "polygon",
          "ref": "geo-wall-faces-002"
        }
      ],
      "quantity": {
        "calculationRef": "calc-demo-op3-001",
        "dimension": "area",
        "unit": "m2",
        "value": 12.5
      }
    }
  ],
  "operationId": "c5b25c38362e4a5af4a0ebe8597514f9c3a27cc7ab9da333d0fa7f543a78e7f2",
  "operationIndex": 3,
  "operationType": "plaster-application",
  "parameters": [
    {
      "name": "thickness",
      "unit": "mm",
      "value": 30
    },
    {
      "name": "material",
      "value": "cement-plaster"
    }
  ],
  "provenance": {
    "authoredAt": "2026-09-16T09:15:00.000Z",
    "authoredBy": "agent-demo-assistant",
    "commandText": "Apply 30 mm plaster to the affected wall faces.",
    "evidenceIds": [],
    "intentRef": "intent-demo-0012",
    "origin": "agent"
  },
  "solutionId": "solution-demo-001",
  "target": {
    "contractVersion": "1.0.0",
    "description": "The affected ground-floor wall faces",
    "geometryRefs": [
      {
        "kind": "polygon",
        "ref": "geo-wall-faces-002"
      }
    ],
    "nodeRefs": [
      "node-wall-002"
    ],
    "selectorKind": "face-set",
    "units": {
      "angular": "rad",
      "linear": "m"
    }
  },
  "versionNumber": 1
}
